{
  "version": 1,
  "updatedAt": "2026-05-11T18:17:20.776Z",
  "profiles": [
    {
      "id": "c679468e-aafa-4aeb-a40a-4e782f072d61",
      "name": "Ava EYKCGU",
      "createdAt": "2026-05-11T18:15:47.265Z",
      "updatedAt": "2026-05-11T18:15:47.397Z"
    },
    {
      "id": "f883db2c-a8d2-4525-8b81-6515b0f33b47",
      "name": "Eli EJWFLEC",
      "createdAt": "2026-05-11T18:16:09.132Z",
      "updatedAt": "2026-05-11T18:16:09.396Z"
    },
    {
      "id": "5bb92558-7552-45de-9602-f3d9580f1405",
      "name": "Drew EJWFLEC",
      "createdAt": "2026-05-11T18:16:09.134Z",
      "updatedAt": "2026-05-11T18:16:09.279Z"
    },
    {
      "id": "30637a1c-d35e-4277-8e0e-0da3e0ec80a4",
      "name": "Finn EJWFLEC",
      "createdAt": "2026-05-11T18:16:10.164Z",
      "updatedAt": "2026-05-11T18:16:10.846Z"
    },
    {
      "id": "268046ea-3da5-4d63-bb76-a1212c7f622b",
      "name": "Ava EJWFLEC",
      "createdAt": "2026-05-11T18:16:11.448Z",
      "updatedAt": "2026-05-11T18:16:11.579Z"
    },
    {
      "id": "08636d61-789f-4a48-9227-c4f5dcaa305e",
      "name": "Ben EJWFLEC",
      "createdAt": "2026-05-11T18:16:12.214Z",
      "updatedAt": "2026-05-11T18:16:12.879Z"
    },
    {
      "id": "72959a54-5ae7-4895-9222-772065caf1a0",
      "name": "Cora EJWFLEC",
      "createdAt": "2026-05-11T18:16:13.214Z",
      "updatedAt": "2026-05-11T18:16:14.295Z"
    },
    {
      "id": "30de8843-7620-4e5a-bb83-46bbac5248a3",
      "name": "Ava LUJLKD",
      "createdAt": "2026-05-11T18:16:59.829Z",
      "updatedAt": "2026-05-11T18:16:59.960Z"
    },
    {
      "id": "d3fc37c5-60fe-442d-a28c-796734c65d91",
      "name": "Eli ETMCOYC",
      "createdAt": "2026-05-11T18:17:15.613Z",
      "updatedAt": "2026-05-11T18:17:15.877Z"
    },
    {
      "id": "869eedcb-97d0-4d58-9f66-84140c0a0c92",
      "name": "Drew ETMCOYC",
      "createdAt": "2026-05-11T18:17:15.614Z",
      "updatedAt": "2026-05-11T18:17:15.759Z"
    },
    {
      "id": "b5d61b25-1a7d-4867-b86b-276989d143e0",
      "name": "Finn ETMCOYC",
      "createdAt": "2026-05-11T18:17:16.646Z",
      "updatedAt": "2026-05-11T18:17:17.327Z"
    },
    {
      "id": "3839da2a-04c9-4a57-84dc-94dad8486a7a",
      "name": "Ava ETMCOYC",
      "createdAt": "2026-05-11T18:17:17.912Z",
      "updatedAt": "2026-05-11T18:17:18.045Z"
    },
    {
      "id": "5ff3b950-110d-4e30-81ee-be76179e58a9",
      "name": "Ben ETMCOYC",
      "createdAt": "2026-05-11T18:17:18.679Z",
      "updatedAt": "2026-05-11T18:17:19.342Z"
    },
    {
      "id": "44f01161-d08e-4e3c-b49f-fa9e0c9b6feb",
      "name": "Cora ETMCOYC",
      "createdAt": "2026-05-11T18:17:19.679Z",
      "updatedAt": "2026-05-11T18:17:20.776Z"
    }
  ],
  "resultsByProfile": {
    "c679468e-aafa-4aeb-a40a-4e782f072d61": {
      "2026-05-11|en|YFRQP": {
        "date": "2026-05-11",
        "won": true,
        "attempts": 1,
        "maxGuesses": 6,
        "submissionCount": 1,
        "updatedAt": "2026-05-11T18:15:47.397Z"
      }
    },
    "5bb92558-7552-45de-9602-f3d9580f1405": {
      "2026-05-11|en|YFRQP": {
        "date": "2026-05-11",
        "won": true,
        "attempts": 1,
        "maxGuesses": 6,
        "submissionCount": 1,
        "updatedAt": "2026-05-11T18:16:09.279Z"
      }
    },
    "f883db2c-a8d2-4525-8b81-6515b0f33b47": {
      "2026-05-11|en|YFRQP": {
        "date": "2026-05-11",
        "won": true,
        "attempts": 2,
        "maxGuesses": 6,
        "submissionCount": 1,
        "updatedAt": "2026-05-11T18:16:09.396Z"
      }
    },
    "30637a1c-d35e-4277-8e0e-0da3e0ec80a4": {
      "2026-05-11|en|YFRQP": {
        "date": "2026-05-11",
        "won": true,
        "attempts": 1,
        "maxGuesses": 6,
        "submissionCount": 2,
        "updatedAt": "2026-05-11T18:16:10.846Z"
      }
    },
    "268046ea-3da5-4d63-bb76-a1212c7f622b": {
      "2026-05-11|en|YFRQP": {
        "date": "2026-05-11",
        "won": true,
        "attempts": 1,
        "maxGuesses": 6,
        "submissionCount": 1,
        "updatedAt": "2026-05-11T18:16:11.579Z"
      }
    },
    "08636d61-789f-4a48-9227-c4f5dcaa305e": {
      "2026-05-11|en|YFRQP": {
        "date": "2026-05-11",
        "won": true,
        "attempts": 1,
        "maxGuesses": 6,
        "submissionCount": 2,
        "updatedAt": "2026-05-11T18:16:12.879Z"
      }
    },
    "72959a54-5ae7-4895-9222-772065caf1a0": {
      "2026-04-30|en|YFRQP": {
        "date": "2026-04-30",
        "won": true,
        "attempts": 1,
        "maxGuesses": 6,
        "submissionCount": 1,
        "updatedAt": "2026-05-11T18:16:13.345Z"
      },
      "2026-05-11|en|YFRQP": {
        "date": "2026-05-11",
        "won": false,
        "attempts": null,
        "maxGuesses": 6,
        "submissionCount": 1,
        "updatedAt": "2026-05-11T18:16:14.295Z"
      }
    },
    "30de8843-7620-4e5a-bb83-46bbac5248a3": {
      "2026-05-11|en|YFRQP": {
        "date": "2026-05-11",
        "won": true,
        "attempts": 1,
        "maxGuesses": 6,
        "submissionCount": 1,
        "updatedAt": "2026-05-11T18:16:59.960Z"
      }
    },
    "869eedcb-97d0-4d58-9f66-84140c0a0c92": {
      "2026-05-11|en|YFRQP": {
        "date": "2026-05-11",
        "won": true,
        "attempts": 1,
        "maxGuesses": 6,
        "submissionCount": 1,
        "updatedAt": "2026-05-11T18:17:15.759Z"
      }
    },
    "d3fc37c5-60fe-442d-a28c-796734c65d91": {
      "2026-05-11|en|YFRQP": {
        "date": "2026-05-11",
        "won": true,
        "attempts": 2,
        "maxGuesses": 6,
        "submissionCount": 1,
        "updatedAt": "2026-05-11T18:17:15.877Z"
      }
    },
    "b5d61b25-1a7d-4867-b86b-276989d143e0": {
      "2026-05-11|en|YFRQP": {
        "date": "2026-05-11",
        "won": true,
        "attempts": 1,
        "maxGuesses": 6,
        "submissionCount": 2,
        "updatedAt": "2026-05-11T18:17:17.327Z"
      }
    },
    "3839da2a-04c9-4a57-84dc-94dad8486a7a": {
      "2026-05-11|en|YFRQP": {
        "date": "2026-05-11",
        "won": true,
        "attempts": 1,
        "maxGuesses": 6,
        "submissionCount": 1,
        "updatedAt": "2026-05-11T18:17:18.045Z"
      }
    },
    "5ff3b950-110d-4e30-81ee-be76179e58a9": {
      "2026-05-11|en|YFRQP": {
        "date": "2026-05-11",
        "won": true,
        "attempts": 1,
        "maxGuesses": 6,
        "submissionCount": 2,
        "updatedAt": "2026-05-11T18:17:19.342Z"
      }
    },
    "44f01161-d08e-4e3c-b49f-fa9e0c9b6feb": {
      "2026-04-30|en|YFRQP": {
        "date": "2026-04-30",
        "won": true,
        "attempts": 1,
        "maxGuesses": 6,
        "submissionCount": 1,
        "updatedAt": "2026-05-11T18:17:19.809Z"
      },
      "2026-05-11|en|YFRQP": {
        "date": "2026-05-11",
        "won": false,
        "attempts": null,
        "maxGuesses": 6,
        "submissionCount": 1,
        "updatedAt": "2026-05-11T18:17:20.776Z"
      }
    }
  }
}
